Data/Investigacion/EXP_07_tfidf_logreg/EXP07_COMPARACION_RESUMEN.csv

,coverage,coverage,coverage,macro_f1,macro_f1,macro_f1,micro_f1,micro_f1,micro_f1,micro_precision,micro_precision,micro_precision,micro_recall,micro_recall,micro_recall
model,EXP04_Baseline_0B_Reglas,EXP05_LogReg_5_features,EXP07_TFIDF_LogReg,EXP04_Baseline_0B_Reglas,EXP05_LogReg_5_features,EXP07_TFIDF_LogReg,EXP04_Baseline_0B_Reglas,EXP05_LogReg_5_features,EXP07_TFIDF_LogReg,EXP04_Baseline_0B_Reglas,EXP05_LogReg_5_features,EXP07_TFIDF_LogReg,EXP04_Baseline_0B_Reglas,EXP05_LogReg_5_features,EXP07_TFIDF_LogReg
target,,,,,,,,,,,,,,,
contenidos,0.3098591549295774,1.0,0.7464788732394366,0.0838831246744332,0.2209009535119276,0.1857747591614224,0.1631701631701631,0.32508073196986,0.2901618929016189,0.3465346534653465,0.1973856209150326,0.1823161189358372,0.1067073170731707,0.9207317073170732,0.7103658536585366
disciplinas,0.3098591549295774,1.0,0.9859154929577464,0.1207028265851795,0.211038961038961,0.1714285714285714,0.3893805309734513,0.3129770992366412,0.2419354838709677,0.6285714285714286,0.2228260869565217,0.1764705882352941,0.282051282051282,0.5256410256410257,0.3846153846153846
roles_documentales,0.3098591549295774,1.0,1.0,0.0776402696061856,0.3405127270957571,0.3339895922510865,0.1666666666666666,0.4752066115702479,0.5446224256292906,0.34,0.3484848484848485,0.4204946996466431,0.1103896103896103,0.7467532467532467,0.7727272727272727

Data/Investigacion/EXP_05_logistic_regression/EXP05_DOCUMENTACION.md

## Resultado

- disciplina: micro-F1=0.3130, macro-F1=0.2110, micro-precision=0.2228, micro-recall=0.5256, coverage=1.0000, hamming_loss=0.3622.
- rol_documental: micro-F1=0.4752, macro-F1=0.3405, micro-precision=0.3485, micro-recall=0.7468, coverage=1.0000, hamming_loss=0.4472.
- contenido: micro-F1=0.3251, macro-F1=0.2209, micro-precision=0.1974, micro-recall=0.9207, coverage=1.0000, hamming_loss=0.4415.